timestamp,user,ai,combined_prompt,client_id,workshop_id,language,conversation_id
2025-10-21 08:43:01.281000+00:00,"placed her tiny hand on a rib, covering less that half perimeter, with so gentle a touch that she hardly put any pressure on the bone. All of the sudden she heard tiny cracking sounds. Chocked by the noice she flew back into Tristans arms, but it was","not the bone that broke. Instead, the ground beneath the skeleton began to shift, revealing a hidden chamber. A soft, luminescent glow emanated from within, casting ethereal patterns on the surrounding trees.

Tristan and Elara exchanged a glance, a mix of fear and curiosity in their eyes. ""We should tell someone,"" Tristan whispered",,,,,conv_68f73dbdcc8081958c0890edef7c670804df05d299f21c4d
2025-10-21 08:55:34.423000+00:00,"Elara's eyes started glowing a warm yellow around her pupils. She felt her body moving towards the chamber, spellbound by the glow that emanated. As Elara moved towards the chamber, Tristan grabbed her wrist and yelled at her: ""Elara, what are you","doing? We need to get out of here!"" But Elara barely heard him, her mind captivated by the mysterious energy pulling her forward.

Inside the chamber, she saw a pedestal with a small, intricately carved stone. The symbols on the stone matched those on the skeleton, glowing brighter as she approached. Elara felt a deep sense of recognition",,,,,conv_68f73dbdcc8081958c0890edef7c670804df05d299f21c4d
2025-10-21 09:01:57.847000+00:00,"like she had seen the carvings before. Tristan had followed into the chamber, filled with fear but also with an even bigger sense of responsibility for Elara. He pulled her arm and tried to pick her up to carry her out of there, but it was as if she","was rooted to the spot, her gaze locked on the stone. ""I have to touch it, Tristan,"" she whispered, her voice distant and dreamlike.

Tristan hesitated, torn between protecting his sister and the strange allure of the stone. ""Okay,"" he finally said, his voice trembling. ""But be quick.""

With a deep breath",,,,,conv_68f73dbdcc8081958c0890edef7c670804df05d299f21c4d
2025-10-21 09:11:47.499000+00:00,"Elara placed her hands on the carvings. She felt an electric wave going through her, making her fell warm and alive. She started feeling lighter and noticed her feet leaving the ground as she started to levitate, but to Tristan who couldn't see the","magic, it looked as though she was enveloped in a gentle, golden light. The chamber filled with a soft hum, resonating with the energy flowing through Elara.

Tristan watched in awe and fear, unsure of what to do. ""Elara, are you okay?"" he called, his voice echoing.

Elara nodded, a",,,,,conv_68f73dbdcc8081958c0890edef7c670804df05d299f21c4d
2025-10-21 09:16:14.831000+00:00,"s she rose higher. She turned around to look at her brother from above, but to her surprise when she turned around in the air she saw that Tristan wasn't alone in the chamber. In fact, Tristan hadn't yelled at her flying in the air, but at her body",,,,,,conv_68f73dbdcc8081958c0890edef7c670804df05d299f21c4d
2025-10-21 11:15:25.936000+00:00,"This is the story of

dsf lsdlæf ælsdfæl sdflæ læsdf læsdfæl slædf læsdfæslædflæsdflæslædflæsdflæsdflæslædfslædflæsdflæslædflæsdflæslædflæsdflæslædflæsdflæsldæflsædlæ læs ældsf læslæ. læss","a small village nestled between the misty mountains and a dense, ancient forest. In this village, there lived a young girl named Elara, known for her curious spirit and insatiable love for stories. Every evening, she would sit by the hearth as her grandmother spun tales of magic and adventure.

One day, as the first light of dawn",,,,,conv_68f76b3e7e288190bdff9bbab6d9a0db01518e40db66425f
2025-10-21 11:17:06.481000+00:00,". This was not anything new, and when they went to the dkslfk sakældf æklasdflæk asældf kalsdfkæ asdfæl alkæsdfklæ asdflæ aslædfka slkdfaslkædf klæasdælkfasækld fælkasd","filtered through her window, Elara decided to explore the forest she had heard so much about. She packed a small bag with essentials and set off, her heart pounding with excitement and a hint of fear.

As she ventured deeper into the woods, she noticed the trees seemed to whisper secrets, their branches swaying gently in the breeze. Suddenly, she",,,,,conv_68f76b3e7e288190bdff9bbab6d9a0db01518e40db66425f
2025-10-21 11:18:05.671000+00:00,.................,"stumbled upon a hidden clearing bathed in golden light. In the center stood an ancient stone circle, covered in vines and mysterious symbols. Captivated, Elara approached, feeling a strange pull toward the stones.

As she touched one of them, the symbols began to glow softly, and a gentle hum filled the air. To her astonishment",,,,,conv_68f76b3e7e288190bdff9bbab6d9a0db01518e40db66425f
2025-10-21 11:18:20.473000+00:00,. And then they went,"silent, revealing a doorway that shimmered with a soft blue light. Elara hesitated for a moment, her heart racing with both trepidation and exhilaration. Taking a deep breath, she stepped through the doorway.

On the other side, she found herself in a vibrant realm where the colors seemed more vivid and the air hummed with magic",,,,,conv_68f76b3e7e288190bdff9bbab6d9a0db01518e40db66425f
2025-10-21 11:33:05.566000+00:00,asdflkaæsdfæl ækasdfkæl asækld,". Creatures of all shapes and sizes wandered the landscape, some familiar and others fantastical. A gentle breeze carried the scent of blooming flowers and the sound of distant laughter.

Elara marveled at the sight, feeling both awe and curiosity. As she explored, she met a kind-hearted creature named Finn, who offered to guide her through this",,,,,conv_68f76b3e7e288190bdff9bbab6d9a0db01518e40db66425f
2025-10-21 11:33:21.337000+00:00,dasf asdælf asdf asdf as,"enchanted world. Finn, a small creature with shimmering scales and bright eyes, explained that the stone circle was a portal between worlds, accessible only to those with a pure heart and a thirst for adventure.

Together, they journeyed through lush valleys and sparkling streams, each step revealing new wonders. Elara felt a deep sense of belonging, as if",,,,,conv_68f76b3e7e288190bdff9bbab6d9a0db01518e40db66425f
2025-10-21 11:33:37.532000+00:00,sadf asdf asdfas,"she had found a piece of herself she never knew was missing. As they traveled, Finn shared stories of the realm’s history and magic, deepening Elara's appreciation for this extraordinary place.

Eventually, they arrived at a grand library built into the trunk of an enormous tree. Inside, shelves overflowed with ancient tomes and scrolls. El",,,,,conv_68f76b3e7e288190bdff9bbab6d9a0db01518e40db66425f
2025-10-21 11:33:55.648000+00:00,asdf sadfasdfasdfasdfasdfalsædf,"ara's eyes widened in amazement. She eagerly explored the library, feeling as though each book held secrets waiting to be uncovered. Finn explained that this library contained the collective knowledge of the realm, preserving stories from both worlds.

As Elara delved into the tales, she realized her own story was just beginning, filled with endless possibilities and adventures yet",,,,,conv_68f76b3e7e288190bdff9bbab6d9a0db01518e40db66425f
2025-10-21 11:34:35.069000+00:00,asdfklæ læksadf lækasklædf klæasdf,"to unfold. Inspired and invigorated, she knew she would return to her village with stories beyond her wildest dreams, ready to share them with her grandmother and friends.

But for now, Elara embraced the magic of this new world, knowing it had awakened a part of her soul that would forever seek wonder and discovery. She smiled at Finn,",,,,,conv_68f76b3e7e288190bdff9bbab6d9a0db01518e40db66425f
2025-10-21 11:34:47.464000+00:00,asdflæ sadf sadf aslædfa,"grateful for the unexpected journey and the friendship they had formed. Together, they continued to explore, each step leading to new discoveries and deeper connections.

Elara knew that no matter where her adventures took her, she would always carry the magic of this realm within her heart, a reminder of the wonders waiting beyond the familiar and the power of curiosity and",,,,,conv_68f76b3e7e288190bdff9bbab6d9a0db01518e40db66425f
2025-10-22 16:36:47.909000+00:00,"This is the story of

* Measuring model
 * - We measure by creating a temporary hidden probe element with the same
 *   dimensions/typography as the page content area.","a peculiar little village named Wisteria Hollow. This village was known for its vibrant, ever-blooming fields and, more curiously, its tradition of measuring everything with",,,,,conv_68f9080544408193acad1cd81145fa370ac8a6274dbcec24
2025-10-22 16:37:06.963000+00:00,"* Measuring model
 * - We measure by creating a temporary hidden probe element with the same
 *   dimensions/typography as the page content area.
 * - When an actual","object needed measuring, the villagers would construct a replica using various materials found in the village square. This peculiar method wasn't just a tradition; it was rooted in a mysterious discovery made",,,,,conv_68f9080544408193acad1cd81145fa370ac8a6274dbcec24
2025-10-22 16:37:31.244000+00:00,"* Terminology
 * - el: a DOM element representing the page content box (either front or back).
 * - htmlString: the text we want to measure, converted to HTML (newlines","and all) to match the exact look and feel of the original. This strange practice emerged after an old clockmaker named Alden stumbled upon an ancient book titled ""The Art",,,,,conv_68f9080544408193acad1cd81145fa370ac8a6274dbcec24
2025-10-22 16:37:50.376000+00:00,"M element representing the page content box (either front or back).
 * - htmlString: the text we want to measure, converted to HTML (newlines become <br","> Full of Hidden Dimensions."" The book contained secrets of precise measurement through the use of replicated elements, which brought a new sense of order to Wisteria Hollow. 

One",,,,,conv_68f9080544408193acad1cd81145fa370ac8a6274dbcec24
2025-10-22 16:38:08.075000+00:00,"// Fallback probe when ref is not available (e.g., during load)
  // Helper to compute the same geometry used by the fallback probe, so
  // mounted-element measurements","day, as the villagers gathered in the square to measure a particularly odd-shaped stone, young Elara noticed something unusual. The shadow cast by their replica seemed to shift in a",,,,,conv_68f9080544408193acad1cd81145fa370ac8a6274dbcec24
2025-10-22 16:55:19.736000+00:00,"const breakpoints = (() => {
      const bps = [0];
      let i = 0;
      const len = newText.length;
      while (i < len) {
        while (i < len && /","strange rhythm, as if responding to a hidden force. Intrigued, she decided to follow it to a secluded glen just outside the village. There, she discovered",,,,,conv_68f9080544408193acad1cd81145fa370ac8a6274dbcec24
2025-10-22 16:55:37.748000+00:00,"/\s/.test(newText[i])) i++;
        while (i < len && !/\s/.test(newText[i])) i++;
        bps.push(i);
      }
      return bps;
    })();","an ancient stone circle, covered in vines and glowing faintly under the moonlight. As she stepped closer, Elara realized each stone had markings similar to those in Alden",,,,,conv_68f9080544408193acad1cd81145fa370ac8a6274dbcec24
2025-10-22 16:56:00.918000+00:00,"j ksajdkfjk sadkjf asjkas fdk     const breakpoints = (() => {
      const bps = [0];
      let i = 0;
      const len = newText.leng","'s mysterious book. These stones, she sensed, were the true origin of the village's unique measuring traditions. With newfound determination, Elara knew this discovery might change the future",,,,,conv_68f9080544408193acad1cd81145fa370ac8a6274dbcec24
2025-10-22 16:56:13.460000+00:00,"const breakpoints = (() => {
      const bps = [0];
      let i = 0;
      const len = newText.lengasdfas dfasd asf dasdf asdf as","of Wisteria Hollow forever. She hurried back to the village, eager to share her findings and unlock the deeper secrets of the ancient book, knowing it was only the beginning",,,,,conv_68f9080544408193acad1cd81145fa370ac8a6274dbcec24
2025-10-22 16:56:39.547000+00:00,"const breakpoints = (() => {
      const bps = [0];
      let i = 0;
      const len = newText.length;
      while (i < len) {
        w","of an extraordinary journey. The villagers, inspired by her courage and curiosity, gathered around to hear her tale. Together, they vowed to explore the power of the stone circle,",,,,,conv_68f9080544408193acad1cd81145fa370ac8a6274dbcec24
2025-11-09 18:46:01.003000+00:00,This is the story of,"Lila, a curious inventor living in the bustling city of Aetheria. Unlike the majority of its inhabitants, who spent their days lost in cloud-reaching skyscrapers, L",,,,,conv_6910e16399d48194987708b3589ca9eb0edd24df36992831
2025-11-09 18:47:29.698000+00:00,"Lila likes to walk around in the city exploring urban neighborhoods, where she looks for new food options. Yesterday she","discovered a hidden alleyway lined with vibrant street art and intriguing scents wafting from small eateries. Drawn by the smell of spices, she followed her nose to a",,,,,conv_6910e16399d48194987708b3589ca9eb0edd24df36992831
2025-11-10 08:15:47.696000+00:00,"small store selling cookies and flowers. The combination of the newly baked cookies and the flowers made her mind think about the time,","she spent with her grandmother in the countryside. Her grandmother used to bake lavender cookies; their scent filled the air, mingling with the blossoms in the garden. Lila decided",,,,,conv_6910e16399d48194987708b3589ca9eb0edd24df36992831
2025-11-10 08:16:59.887000+00:00,"to go home. She missed her grandmother, and she just got reminded about how the grandfather took both of their lives a year ago.","She felt a pang of sorrow mixed with a longing for those simple, joyful moments. Determined to honor her grandmother's memory, Lila decided to recreate her lavender cookies using",,,,,conv_6910e16399d48194987708b3589ca9eb0edd24df36992831
2025-11-10 08:18:20.254000+00:00,"only butter. She had lost everything else, since she lost her grandmother. She couldn't get up in the morning and she had lost her job. The pain was too","intense, and the world seemed colorless without her grandmother's warmth. But as she mixed the butter, flour, and carefully chosen lavender, she found solace in the familiar",,,,,conv_6910e16399d48194987708b3589ca9eb0edd24df36992831
2025-11-10 08:19:26.974000+00:00,"smell of butter. God damn she loved butter. She once just ate a whole stick of butter, because she had nothing left.","Despite the challenges, the act of baking offered her a small, comforting ritual. As the cookies baked, she felt the first flicker of hope she'd experienced in months—a hint",,,,,conv_6910e16399d48194987708b3589ca9eb0edd24df36992831
2025-11-10 08:20:37.128000+00:00,"for something new. Maybe this was the year she went to the butter-festival in Paris. She had heard, that Joe Biden was a big butter-enthusiast like her,","and the thought amused her. She imagined meeting people who shared her passion, perhaps even forging new friendships over buttery delights. As the cookies cooled, Lila realized",,,,,conv_6910e16399d48194987708b3589ca9eb0edd24df36992831
2025-11-10 08:21:52.525000+00:00,"that this might be the last year, that Joe Biden would participate in the butter-festival. She cried a bit and opened her computer, so she could buy","a ticket to Paris. As she booked her flight, she felt a thrill of anticipation. Maybe this adventure would spark more than just a taste for butter—perhaps it would be",,,,,conv_6910e16399d48194987708b3589ca9eb0edd24df36992831
2025-11-10 08:23:07.149000+00:00,"a new beginning of something new. Perhaps this would make her life start again. Lily didn't think twice. She bought the most expensive tickets,","determined to make the most of this opportunity. With her heart set on the festival, Lila packed her bags, feeling a newfound sense of purpose and excitement. Paris awaited",,,,,conv_6910e16399d48194987708b3589ca9eb0edd24df36992831
2025-11-10 08:24:04.899000+00:00,and Lily with her bag full of butter was coming. She wondered what might be the theme this year. Last year the theme was goats,,,,,,conv_6910e16399d48194987708b3589ca9eb0edd24df36992831
2025-11-10 15:58:15.793000+00:00,"This is the story of

a princess. She was headstrong but also kind and caring. She loved her life and her favourite activity was reading. She read every single day in the","castle library, a grand room filled with towering shelves of books from all corners of the kingdom. Her favorite spot was a cozy nook by a stained-glass window, which painted",,,,,conv_69120b0be9a881908567c1dfa912a6d90a309a13d5ea8eef
2025-11-10 16:00:09.049000+00:00,"an archer. To be more precise, an elf. The tall elf was aiming at a white deer, the deers skin shining against the forests' deep greenery. When the light hit","the stained glass just right, the colors danced across the pages of her book. The princess, named Elara, often imagined herself stepping into that forest, hidden among leaves and",,,,,conv_69120b0be9a881908567c1dfa912a6d90a309a13d5ea8eef
2025-11-10 16:01:47.395000+00:00,"running away forever. She was rebellious, but she did not want to leave her life behind. She had friends and was well-taken care of. One day she went down by","the river that wound through the castle grounds. There, she found a small wooden boat tethered loosely to a post. Curiosity sparked within her, and she decided to give",,,,,conv_69120b0be9a881908567c1dfa912a6d90a309a13d5ea8eef
2025-11-10 16:03:22.496000+00:00,"it a good look. She knew that this boat belonged to the groundkeeper - and oh how handsome he was. She used to think about him often, the young man was just about","her age, with a charming smile and an easy laugh. His name was Aiden, and he had a knack for crafting stories as captivating as her books. As Elara",,,,,conv_69120b0be9a881908567c1dfa912a6d90a309a13d5ea8eef
2025-11-10 16:05:16.767000+00:00,"loved to listen to his stories. They met up regularly next to the lakes and spent most of their time just reading by each other. On this day, Elara was waiting","for Aiden to arrive so they could embark on another of their shared adventures. As she sat by the boat, she noticed a mysterious, folded piece of paper tucked under the",,,,,conv_69120b0be9a881908567c1dfa912a6d90a309a13d5ea8eef
2025-11-10 16:06:44.212000+00:00,ropes. It was from Aiden. He will be delayed and that she should just get into the boat and row over to the house on her own. Elara got scared because the,"river was known for its unpredictable currents, but Aiden reassured her in the note that he had marked a safe path with floating lanterns. Trusting his guidance, she",,,,,conv_69120b0be9a881908567c1dfa912a6d90a309a13d5ea8eef
2025-11-10 16:08:11.884000+00:00,jumped in the boat and rowed across. Aiden's floating lanterns started popping up by the lake as she was rowing. She knew she could trust him with,"her heart racing a little at the thrill of this unexpected journey. As the boat followed the gentle glow of the lanterns, she could see the silhouette of a quaint cottage nestled",,,,,conv_69120b0be9a881908567c1dfa912a6d90a309a13d5ea8eef
2025-11-10 16:09:15.885000+00:00,in between the pine trees of the forest. As the gentle current took her boat to the shore she sighed when she smelled the warm food Aiden was preparing for,"their evening together. The scent of spiced stew wafted through the air, mingling with the earthy aroma of pine. As Elara stepped onto the shore, A",,,,,conv_69120b0be9a881908567c1dfa912a6d90a309a13d5ea8eef
2025-11-10 16:11:02.570000+00:00,Aidens siluette danced behind the windows of the cottage. She walked up the short pebbled path to the cottage. She was smiling miles wide as Aiden opened the door,"and welcomed her inside. The warmth of the cottage enveloped her, and she felt a sense of belonging she'd never known before. They spent the evening dining and sharing stories,",,,,,conv_69120b0be9a881908567c1dfa912a6d90a309a13d5ea8eef
2025-11-10 16:11:56.004000+00:00,and the food he made tasted so very good. His eyes twinkled in the candlelight as he regarded her with more warmth anyone has ever before. He extended a hand,"to her, inviting her to dance. As they swayed gently to the music of the crackling fire, Elara realized that this place, with Aiden, felt like",,,,,conv_69120b0be9a881908567c1dfa912a6d90a309a13d5ea8eef
2025-11-10 20:24:36.114000+00:00,This is the story of,"a young girl named Elara, who lived in a quaint village nestled between towering mountains and dense, whispering forests. From a young age, Elara was known for her",,,,,conv_691249fd97308197b06e97ca5d649f45080645ae33d1bf00
2025-11-10 20:27:23.579000+00:00,"inability to climb trees. This was a big deal in the small village, because this was an important part","of the annual Harvest Festival. Each year, children would race to the tallest apple trees, competing to gather the ripe fruit for the grand feast. Despite her struggles, Elara",,,,,conv_691249fd97308197b06e97ca5d649f45080645ae33d1bf00
2025-11-10 20:28:46.472000+00:00,"tried her best every year, only to fall down and be shamed. She was considered a loser. the biggest loser of","the village, whispers often labeling her as such. But Elara's heart was resilient, her spirit unbroken. With each fall, she learned to adapt, finding other ways",,,,,conv_691249fd97308197b06e97ca5d649f45080645ae33d1bf00
2025-11-10 20:30:38.264000+00:00,show the villagers what awesome skills she mastered. She was excellent at falling and making a fool of herself which,"unexpectedly became a form of entertainment. Villagers began to appreciate her comedic flair and the light-hearted laughter she brought. Her unique talent endeared her to many, transforming her",,,,,conv_691249fd97308197b06e97ca5d649f45080645ae33d1bf00
2025-11-10 20:32:05.339000+00:00,"into a girl with at strange god complex. Suddenly, all she would do was climb trees and fall. all she wanted was to","perfect her comedic routine, turning every tumble into a theatrical performance. While some worried about her obsession, others were captivated by her determination and unconventional charm. This new persona allowed El",,,,,conv_691249fd97308197b06e97ca5d649f45080645ae33d1bf00
2025-11-10 20:34:31.665000+00:00,to gain some climbing skills that she eventually had to hide. No one could know she was falling on purpose now. What,"started as a comedy act had become a secretive quest to conquer the very challenge that once defeated her. Elara spent her nights practicing in solitude, scaling trees with newfound agility",,,,,conv_691249fd97308197b06e97ca5d649f45080645ae33d1bf00
2025-11-10 20:35:34.026000+00:00,"and talking with the squirrels. the only ones that could truly understand her. You see, she actually had a lot in","common with them—an outsider’s spirit and an insatiable curiosity. The squirrels became her silent cheerleaders, encouraging her with their bright eyes and nimble movements. As",,,,,conv_691249fd97308197b06e97ca5d649f45080645ae33d1bf00
2025-11-10 20:36:48.889000+00:00,the years went by she lost the ability to communicate with the townsfolk. all she did now was dancing with the squirrels and,"listening to the wind's secrets. This newfound detachment worried the villagers, yet there was an undeniable magic in her presence. Her dances became a bridge between the human world",,,,,conv_691249fd97308197b06e97ca5d649f45080645ae33d1bf00
2025-11-10 20:38:01.894000+00:00,and the world of the undead. An eerie fog came over the village as the underworld began to creep into theirs. It,"swirled around Elara, drawn by her unique bond with the unseen. Yet, instead of fear, she felt an odd sense of belonging. She sensed the balance needed",,,,,conv_691249fd97308197b06e97ca5d649f45080645ae33d1bf00
2025-11-10 20:39:29.856000+00:00,"cake. undead or not, everyone loves cake. even squirrels. even Elara. this was the only way",,,,,,conv_691249fd97308197b06e97ca5d649f45080645ae33d1bf00
2025-11-11 06:12:43.524000+00:00,This is the story of,"a small village nestled in the hidden valleys of the Whispering Woods. In this secluded place, where time seemed to stand still, lived a young girl named Elara. She",,,,,conv_6912d3d2074c8197adc6c9e56408225c0a4f5cb536497774
2025-11-11 06:16:47.834000+00:00,had a companion cybernetic llama that was bionically enhanced with the latest LLM and who with whom she spent hours creating stories and,"exploring the dense, mysterious forest. The llama, named Zephyr, had been a gift from her late grandfather, a brilliant engineer who had a penchant for blending technology with",,,,,conv_6912d3d2074c8197adc6c9e56408225c0a4f5cb536497774
2025-11-11 06:19:08.767000+00:00,"biology. As far as Elara could tell, no other child in the village had such a sophisticated pet. She did not know how she felt about","being so different from the other children. While some admired Zephyr’s unique abilities, others were jealous or fearful. Despite these mixed reactions, Elara cherished her bond with Ze",,,,,conv_6912d3d2074c8197adc6c9e56408225c0a4f5cb536497774
2025-11-11 06:23:16.232000+00:00,phyr. On night Elara woke up panicked after sleeping through an awful nightmare. She dreamt that Zephyr was forever,"lost in the labyrinthine depths of the Whispering Woods. The trees seemed to close in, their branches twisting into impenetrable barriers. Determined to ensure her dream wasn't",,,,,conv_6912d3d2074c8197adc6c9e56408225c0a4f5cb536497774
2025-11-11 06:24:57.491000+00:00,"real, she run out to the staple and found her cherished familiar sound asleep. She cuddle him all night, like she used to util the morning , and both woke","up to the soft glow of dawn filtering through the trees. Relieved, Elara whispered to Zephyr about her dream, and he nuzzled her reassuringly. Feeling",,,,,conv_6912d3d2074c8197adc6c9e56408225c0a4f5cb536497774
