timestamp,user,ai,combined_prompt,client_id,workshop_id,language,conversation_id
2025-09-30 11:47:46.150000+00:00,asdflksalkdflkaskldfklsakldfklasdlkf,"It seems like there was a mix-up with your message. If you’d like to continue the collaborative short story, please provide a prompt",,,,,
2025-10-01 07:32:25.317000+00:00,"This is the story of

vdfsfkldsklfklsdklfklsdklfklsdklfsd","a small town nestled between rolling hills, where the air was thick with the scent of pine and the whispers of forgotten legends. The towns",,,,,
2025-10-01 07:33:04.706000+00:00,sdfajksdfjklasdfjklasddkslfaksdlk,"It seems like there was a mix-up with your message. If you’d like to continue the collaborative short story, please provide a prompt",,,,,
2025-10-01 07:33:06.692000+00:00,lsdlfalæsdflæalsædflæasdlæflæasdlæaf,"It seems like there might have been a mix-up with your message. If you’d like to continue the collaborative short story, please share",,,,,
2025-10-01 07:39:31.403000+00:00,A big man with a beard and trouser,"legs that seemed to stretch on for miles ambled down the cobblestone street, his heavy boots echoing against the ancient stones.",,,,,
2025-10-01 07:39:47.688000+00:00,"And when he walked, his nose was","slightly elevated, as if he were perpetually sniffing the air for secrets hidden just out of reach. Each step he took was",,,,,
2025-10-01 08:12:25.105000+00:00,"a big one, that made earthquackes","The ground trembled beneath their feet, a low rumble that seemed to echo from the very core of the earth. Clara and Jonah",,,,,
2025-10-01 08:14:31.630000+00:00,"This is the story of

a mana iujdsijfajlsdfjklajklsdf as","a young sorceress named Elara, who lived in the quaint village of Eldergrove. Nestled between ancient woods and shimmering",,,,,
2025-10-01 08:19:39+00:00,"This is the story of

BananaBananaBananaBananaBanana","a curious little creature who lived in the vibrant, sun-drenched jungles of Fruitania. BananaBananaBananaBanana",,,,,
2025-10-01 08:21:32.430000+00:00,"This is the story of

Bing boong, the magical boomer","Bing Boong, the magical boomer, was no ordinary creature. With a shimmering coat that changed colors with the seasons, he",,,,,
2025-11-13 12:34:34.539000+00:00,"This is the story of

There once was a young woman who had trust issues. She had been betrayed by her ex-boyfriend who cheated on her","with her best friend, leaving her feeling shattered and vulnerable. The experience had made her wary of opening up to anyone new, and she found herself constantly questioning the motives of those",,,,,conv_006cb479-ccd3-40d1-83fb-4b614573f636
2025-11-13 12:36:05.046000+00:00,who claimed they loved her. This made her hard to reach but also very lonely. She was lonely like this for many years but finally she decided,"to take a chance and start attending social events again, hoping to meet someone who could help her heal and learn to trust once more. It was at one of these events,",,,,,conv_006cb479-ccd3-40d1-83fb-4b614573f636
2025-11-13 12:37:38.170000+00:00,that she meet another young woman just like her self who also had trust issues. They meet many times without ever talking much or becoming close.,"until one evening, when they both found themselves sitting alone at a small café, each lost in their own thoughts. The atmosphere was quiet and intimate, and somehow, it seemed",,,,,conv_006cb479-ccd3-40d1-83fb-4b614573f636
2025-11-13 12:39:04.145000+00:00,as if they where destined to meet. They started talking and soon found out they had a lot in common. They started meeting more and over time they,"developed a deep and meaningful connection, one that was built on mutual understanding and respect. They shared their stories, their fears, and their dreams with each other, and as",,,,,conv_006cb479-ccd3-40d1-83fb-4b614573f636
2025-11-13 12:40:11.365000+00:00,time whent on their connection became more than just friendship it became love. For a long time they,"had been afraid to acknowledge the true nature of their feelings, fearing that it might ruin the beautiful bond they had established. But as they looked into each other's eyes, they",,,,,conv_006cb479-ccd3-40d1-83fb-4b614573f636
2025-11-13 12:41:41.674000+00:00,knew excaktly what the other person was feeling. They finally burst free of their prisons of isolation and oppened up for love,"and allowed themselves to be vulnerable, to trust, and to surrender to the beauty of their relationship. As they embraced each other, they felt a sense of freedom and joy that",,,,,conv_006cb479-ccd3-40d1-83fb-4b614573f636
2025-11-13 12:42:58.048000+00:00,they haden't felt in ages. However they where out of training in trusting and their relationsship,"was put to the test as they navigated the complexities of intimacy, communication, and compromise. They stumbled upon old patterns and fears, but this time, they had each other",,,,,conv_006cb479-ccd3-40d1-83fb-4b614573f636
2025-11-13 12:44:29.885000+00:00,. They where determined to not let this relationship be destroyed as well and in the end they succeded. They,"built a life together, one that was filled with love, laughter, and a deep understanding of each other's strengths and weaknesses. They proved to themselves that they were capable of",,,,,conv_006cb479-ccd3-40d1-83fb-4b614573f636
2025-11-13 12:46:03.031000+00:00,overcoming obstacles and regaining trust i humans. Their relationship also allowed them to open more up to other humans and form meaningfull,"connections with others, and as they looked back on their journey, they realized that their love had been the catalyst for a profound transformation, one that had brought healing, growth,",,,,,conv_006cb479-ccd3-40d1-83fb-4b614573f636
2025-11-13 12:47:23.227000+00:00,love and life. This was the true meaning of life and they learned that nothing can kill love. They,"lived happily ever after, surrounded by the beauty and wonder of life, and their love continued to flourish, a beacon of hope and inspiration to all those around them, a",,,,,conv_006cb479-ccd3-40d1-83fb-4b614573f636
2025-10-21 11:36:14.377000+00:00,This is the story of,"a small, seaside town, hidden away from the rest of the world by a curtain of misty rain and rugged cliffs. The town was called Ravenswood, and it had a reputation for being a place where time stood still, where the air was sweet with the scent of saltwater and the sound of gulls filled the air. It was a",,,,,conv_06d092f9-8297-41db-8af0-820f4e274fc2
2025-10-21 11:38:01.240000+00:00,asdf asdf asdf asdf asd,"place where the rhythms of nature dictated the pace of life, and the residents of Ravenswood had grown accustomed to the gentle lapping of the waves against the shore and the cry of the gulls wheeling overhead. Despite the tranquility of the town, there was a sense of mystery that shrouded Ravenswood, a feeling that there was something",,,,,conv_06d092f9-8297-41db-8af0-820f4e274fc2
2025-10-21 11:38:29.193000+00:00,"Something in the shadows lurking, waiting for them to do something. To step wrong or","make a mistake, to wander too far from the safety of the town's narrow streets and worn cobblestones. The residents of Ravenswood had always been wary of the darkness that gathered beyond the reach of the flickering street lamps, a darkness that seemed to seethe and twist with a malevolent life of its own. And at the heart of",,,,,conv_06d092f9-8297-41db-8af0-820f4e274fc2
2025-10-21 11:38:46.040000+00:00,of it all was a young,"woman named Aria, with eyes as gray as the sea and hair as black as the night. She was a quiet, enigmatic presence in the town, with a way of moving that was almost invisible, as if she were a shadow herself. The townsfolk knew little about Aria, except that she lived in the old, crumbling lighthouse",,,,,conv_06d092f9-8297-41db-8af0-820f4e274fc2
2025-10-21 11:38:58.838000+00:00,asdf alksdfæk aslædkf klæasdf,"on the outskirts of town, and that she spent most of her days wandering the windswept coast, collecting strange and colorful shells, and gazing out to sea with an intensity that made the fishermen nervous. Some said she was waiting for something, or someone, and that her eyes held a deep and abiding sorrow, a sense of loss that",,,,,conv_06d092f9-8297-41db-8af0-820f4e274fc2
2025-10-21 11:39:35.498000+00:00,Then at one day when the seagulls started screaming the water froze and she froze and everyone froze. Why? The wind only knew,"and it whispered a haunting melody that only Aria seemed to hear, a melody that spoke of ancient secrets and forgotten lore. As the wind's whispers faded away, the ice that had formed on the water began to crack and shatter, revealing a figure standing in the distance, a figure that seemed to be made of the same misty substance as",,,,,conv_06d092f9-8297-41db-8af0-820f4e274fc2
2025-10-21 11:39:44.258000+00:00,lkæg sdlæfg sdfgsd f,"the sea itself, with eyes that burned like embers from a long-dead fire. The figure began to move towards the shore, its pace slow and deliberate, as if it were savoring the moment, and Aria, still frozen in place, felt an inexplicable sense of recognition, as if she were staring into the face of a",,,,,conv_06d092f9-8297-41db-8af0-820f4e274fc2
2025-10-21 11:39:49.154000+00:00,dsfg sdfg sdfg sdfg sdfg,"long-forgotten memory, a memory that stirred a deep and primal fear within her. The figure drew closer, its misty form coalescing into a face that was both familiar and yet utterly alien, a face that spoke of secrets and mysteries that lay beyond the veil of the mundane world. And as the figure's eyes locked onto Aria",,,,,conv_06d092f9-8297-41db-8af0-820f4e274fc2
2025-10-21 11:40:21.980000+00:00,Her. dsfjkdsjk. jk jk. jk j jkj kj kjk kj jk jk jk jk jk jk jk jk jk jk jk jkjk jk jk jk jk jk jk jk jk jk jk jk jk jk jk jk jk jk jk jk jk jk jk jk jk j jk jk jk jkj j kj j kjk jk jk jk jk jk jk jk jk jk jk jk jk jk jk jk jk j kj jk jk jk jk. jk jk,"world seemed to slow down, and all that was left was the sound of the waves gently lapping at the shore, and the soft whisper of the misty figure's voice, speaking a single, haunting word: ""Aria..."" The sound of her own name was like a key turning in a lock, and suddenly, the memories came flooding back",,,,,conv_06d092f9-8297-41db-8af0-820f4e274fc2
2025-10-21 11:47:18.870000+00:00,jklclk asdlkgd sagf,,,,,,conv_06d092f9-8297-41db-8af0-820f4e274fc2
2025-11-11 16:09:45.732000+00:00,This is the story of,"a lighthouse keeper who forgot how to sleep.

Mara had tended the beacon on Skellig Point for seven years, watching ships pass",,,,,conv_07ec1a21-00a8-494b-9747-ef2f719abd5a
2025-11-11 16:12:59.933000+00:00,"She looked at the dark sea, waiting for sign of movement that was coming closer. One night a large cruiseline lit up the night. She almost felt blinded","by the thousand glowing portholes, each one a tiny world of laughter and music drifting across the water. The vessel moved like a floating city, imposs",,,,,conv_07ec1a21-00a8-494b-9747-ef2f719abd5a
2025-11-11 16:15:17.707000+00:00,"impossible to miss. Usually the water was calm, only a handful of ships passing by. This was not usual. Even the lights were glimmering","strangely—pulsing in rhythms that didn't match the waves. Mara pressed her face against the cold glass of the lighthouse gallery, her breath fo",,,,,conv_07ec1a21-00a8-494b-9747-ef2f719abd5a
2025-11-11 16:18:12.806000+00:00,"foggy in the chill night air. Without knowing why she grabbed the flashlight from the table and put the red lights on it, pointing it toward the ship. From one","of the upper decks, an answering flash—red, then red again, then darkness. Her heart quickened. In seven years, no ship had ever responded to",,,,,conv_07ec1a21-00a8-494b-9747-ef2f719abd5a
2025-11-11 16:20:10.304000+00:00,"her, when she flashed the red lights. Lighthouses were somehow less relevent these days, but she had inherited this one from her uncle. In his will there had been","a sealed letter marked ""Open only when the red ship answers."" She'd laughed at the time, thinking it another of Uncle Gareth's eccentricities.",,,,,conv_07ec1a21-00a8-494b-9747-ef2f719abd5a
2025-11-11 16:22:39.434000+00:00,She got up quickly and found the letter in a drawer. Her hands were shaking with excitement as she dragged a finger along the envelope's edge to open it and pulled,"the yellowed paper free. Uncle Gareth's spidery handwriting covered the page:

*Mara, if you're reading this, they've finally",,,,,conv_07ec1a21-00a8-494b-9747-ef2f719abd5a
2025-11-11 16:34:58.536000+00:00,"found a way to cross into our world. You need to find a way to get onboard the ship, find a woman named Hilda and tell her to",stop the engine before midnight. She'll know what it means. Trust no one else. The dinghy is ready—I've kept it maintained for this moment. The,,,,,conv_07ec1a21-00a8-494b-9747-ef2f719abd5a
2025-11-11 16:37:09.512000+00:00,"moment the engine has been turned off, get out of there and return to safety here in the lighthouse. All will be well. Sincerely, Gareth."" Mara looked at the","clock—11:17 PM. Forty-three minutes. 

She grabbed her uncle's old peacoat from the hook and raced down the spiral stairs",,,,,conv_07ec1a21-00a8-494b-9747-ef2f719abd5a
2025-11-11 16:38:57.026000+00:00,to get to the dinghy. She could make it if she rowed fast but something told her she would have to be quiet too. Sliding into the small boat she began,"to row with long, steady strokes, muffling the oars as best she could. The cruise ship loomed larger with each pull, its strange pulsing",,,,,conv_07ec1a21-00a8-494b-9747-ef2f719abd5a
2025-11-11 16:41:16.680000+00:00,"lights drawing her closer. When she got close to the boat, she could see a ladder hanging off the side of the railing. For her? She didn't have time to let the",,,,,,conv_07ec1a21-00a8-494b-9747-ef2f719abd5a
2025-10-16 13:24:27.685000+00:00,"This is the story of

the wizard Lizard, who had a burning wish to find himself a girlfriend. The only problem was, that he had no idea how to find one.","One day, while wandering through the Enchanted Forest, he stumbled upon a mysterious book titled ""The Art of Courtship."" Curious, he opened it and began",,,,,conv_09d881cc-f751-4c13-99b4-1c61d241aed5
2025-10-16 13:26:44.600000+00:00,to read the three pieces of advice that the book gave. The first,"piece of advice was to be himself and not try to change who he was to impress someone else. The second was to show kindness and compassion to all, and the third was to be brave and take the risk of putting himself out there. Lizard felt a newfound confidence and decided to put the advice into action.",,,,,conv_09d881cc-f751-4c13-99b4-1c61d241aed5
2025-10-16 13:28:47.691000+00:00,"Unfortunately, Lizard did not understand the advice and subsequently acted totally opposite to their desired effects.","Instead of being himself, he tried to transform into what he thought others would find attractive, casting spells to change his appearance and personality. Instead of showing kindness and compassion, he became overly cautious and distant, afraid of saying the wrong thing. And instead of being brave, he avoided any situation where he might have to interact with potential girlfriends. 

Despite",,,,,conv_09d881cc-f751-4c13-99b4-1c61d241aed5
2025-10-16 13:30:36.533000+00:00,"this, Lizard went out into the forest, where he met a talking deer.","The talking deer, named Daphne, was graceful and wise. She noticed Lizard's discomfort and asked him what was troubling him. Lizard, feeling a strange sense of trust, confided in her about his struggles and the advice from the book. Daphne listened carefully and then smiled gently. ""True connection comes from being genuine,""",,,,,conv_09d881cc-f751-4c13-99b4-1c61d241aed5
2025-10-16 13:33:04.199000+00:00,"""Oh how right you are"" said Lizard, ""how I wish that you were human and could be my girlfriend.""","Daphne chuckled softly, her eyes twinkling with amusement. ""Wishes have a way of coming true, especially for a wizard,"" she said. Before Lizard could respond, a warm glow enveloped Daphne, and she began to transform. In a burst of light, she stood before him as a beautiful woman, still retaining the",,,,,conv_09d881cc-f751-4c13-99b4-1c61d241aed5
2025-10-16 13:36:51.641000+00:00,intelligent look that she had had previously as a deer. Lizard felt hot with joy and wanted to kiss her.,"Daphne, now a woman, took a step closer to Lizard, her eyes warm and understanding. ""You don't need to change who you are to find love,"" she said softly. ""I see the true you, and I like what I see."" Lizard's heart raced, and he leaned in, their lips meeting in a",,,,,conv_09d881cc-f751-4c13-99b4-1c61d241aed5
2025-10-16 13:39:27.011000+00:00,"long kiss. Suddenly engulfed with lust, Lizard asked ""do you want to come home with me?"".","Daphne pulled back slightly, her expression gentle but serious. ""Lizard, love is about more than just the moment. It's about respect, understanding, and building a connection. Let's take things one step at a time,"" she said. Lizard nodded, feeling a bit embarrassed but also grateful for her wisdom. ""You're right",,,,,conv_09d881cc-f751-4c13-99b4-1c61d241aed5
2025-10-16 13:45:11.427000+00:00,"but I still really feel very attracted to you and want you.""","Daphne smiled warmly, placing a hand on Lizard's shoulder. ""I feel the same way, but let's not rush into anything. We have a whole future to explore together. For now, how about we get to know each other better? We can go for a walk, or you can tell me more about your life as a",,,,,conv_09d881cc-f751-4c13-99b4-1c61d241aed5
2025-10-16 13:46:46.279000+00:00,"wizard. ""But I feel like it would be more interesting to hear about you and your life as a deer"" answered Lizard.","Daphne laughed, a sound like wind chimes in the forest. ""Fair enough,"" she said. ""I've lived in the Enchanted Forest for many years, watching over the creatures and the land. I've seen the beauty and the magic of nature, and I've learned a lot about the world. What about you? What",,,,,conv_09d881cc-f751-4c13-99b4-1c61d241aed5
2025-10-16 13:47:59.923000+00:00,do you think about the governments current environmental policy?,"Lizard looked a bit taken aback by the sudden shift in话题, but he tried to respond thoughtfully. ""Well, I haven't really thought much about it, to be honest. As a wizard, I spend most of my time studying ancient texts and practicing spells. But I do care about the forest and the creatures that live here.",,,,,conv_09d881cc-f751-4c13-99b4-1c61d241aed5
2025-11-06 13:13:43.031000+00:00,This is the story of,"a young girl named Sophia who lived in a small, seaside village surrounded by towering cliffs and mysterious caves. She had always been drawn to the sea, spending hours exploring the tide",,,,,conv_0b515949-4de8-486e-be19-8654481a44cc
2025-11-06 13:13:50.780000+00:00,i if (shouldFlip && flipDirection === 'backward') { zIndex = 2000; } else if (shouldFlip && flipDirection === 'forward') { zIndex,"was not relevant to Sophia's life, as she was more concerned with the strange occurrences that had been happening in the village, such as the unexplained flickering of the l",,,,,conv_0b515949-4de8-486e-be19-8654481a44cc
2025-11-06 13:13:56.861000+00:00,i if (shouldFlip && flipDirection === 'backward') { zIndex = 2000; } else if (shouldFlip && flipDirection === 'forward') { zIndex,"seemed to be a snippet of code that Sophia's friend, a brilliant inventor named Alex, had been working on in his small workshop by the sea. Alex was trying to",,,,,conv_0b515949-4de8-486e-be19-8654481a44cc
2025-11-06 13:14:05.688000+00:00,i if (shouldFlip && flipDirection === 'backward') { zIndex = 2000; } else if (shouldFlip && flipDirection === 'forward') { zIndex,"create a machine that could manipulate the environment, but Sophia was more focused on the legend of the mermaid that was said to appear in the village every hundred years, and the",,,,,conv_0b515949-4de8-486e-be19-8654481a44cc
2025-11-06 13:14:18.124000+00:00,i if (shouldFlip && flipDirection === 'backward') { zIndex = 2000; } else if (shouldFlip && flipDirection === 'forward') { zIndex,"strange code that Alex was working on seemed to be interfering with Sophia's search for the truth about the mermaid, as she stumbled upon an ancient book in the village library",,,,,conv_0b515949-4de8-486e-be19-8654481a44cc
2025-11-06 13:14:24.608000+00:00,i if (shouldFlip && flipDirection === 'backward') { zIndex = 2000; } else if (shouldFlip && flipDirection === 'forward') { zIndex,"that contained a cryptic message which read: ""When the tide flips, the truth reveals itself."" Sophia wondered if this message was connected to the strange occurrences in the village,",,,,,conv_0b515949-4de8-486e-be19-8654481a44cc
2025-11-06 13:14:33.254000+00:00,i if (shouldFlip && flipDirection === 'backward') { zIndex = 2000; } else if (shouldFlip && flipDirection === 'forward') { zIndex,"and as she pondered the meaning of the message, a strong gust of wind blew through the village, causing the doors of Alex's workshop to swing open, revealing a strange",,,,,conv_0b515949-4de8-486e-be19-8654481a44cc
2025-11-06 13:14:46.386000+00:00,i if (shouldFlip && flipDirection === 'backward') { zIndex = 2000; } else if (shouldFlip && flipDirection === 'forward') { zIndex,"device that Alex had been building, which suddenly sprang to life, emitting a bright light that illuminated the entire village, and Sophia felt herself being drawn towards the sea, as",,,,,conv_0b515949-4de8-486e-be19-8654481a44cc
2025-11-06 13:16:18.576000+00:00,i if (shouldFlip && flipDirection === 'backward') { zIndex = 2000; } else if (shouldFlip && flipDirection === 'forward') { zIndex,"the machine's light enveloped her, Sophia saw a vision of the mermaid, who spoke to her in a voice that echoed in her mind, saying ""The tide has",,,,,conv_0b515949-4de8-486e-be19-8654481a44cc
2025-11-06 13:16:24.316000+00:00,i if (shouldFlip && flipDirection === 'backward') { zIndex = 2000; } else if (shouldFlip && flipDirection === 'forward') { zIndex,,,,,,conv_0b515949-4de8-486e-be19-8654481a44cc
2025-11-06 12:16:16.855000+00:00,"This is the story of

John Cena, the famous wrestler also known for his famous warcry LETS FLIPFLOPPING DO THIS. Which a lot of people","misinterpreted as ""Let's do this,"" but only his true fans knew the authentic phrase that fueled his unrelenting passion for body-slamming his opponents. One day",,,,,conv_0bb56093-3033-4615-bb70-ebfa4135589a
2025-11-06 12:17:02.202000+00:00,"John would take a stroll in his mama van, drop K-dot off, cause I know he trynna flock on Sherane tonight. But","little did John know, K-dot, aka Kendrick Lamar, had other plans, and as he stepped out of the mama van, he whispered to John, ""Yo, Cena",,,,,conv_0bb56093-3033-4615-bb70-ebfa4135589a
2025-11-06 12:17:59.759000+00:00,"Hair pitch black like the midnight sky Eyes like the jungle, you're something wild Her sweet melody sings","to the rhythm of the African drums, and John's warrior spirit began to stir, as he remembered the enchanting songstress, Sherane, who had captured Kendrick's heart",,,,,conv_0bb56093-3033-4615-bb70-ebfa4135589a
2025-11-06 12:18:18.800000+00:00,"Nothing here changes, seasons go by You said, ""Hello, "" you said, ""Goodbye"" Did you run away? Mariella, where did you go?","The echoes of her name lingered in the air, as John's mind began to wander, recalling the tales Kendrick had shared about his tumultuous relationship with Sherane, but",,,,,conv_0bb56093-3033-4615-bb70-ebfa4135589a
2025-11-06 12:18:57.034000+00:00,"Okay, I know that's borderline Compton or Paramount ""Well, is it Compton?"" ""No,"" she replied Then quickly start battin' her eyes I strictly had","to have her, and the city lights of Paramount blurred together as John's mama van sped down the boulevard, the sound of Kendrick's storytelling fading into the distance, replaced",,,,,conv_0bb56093-3033-4615-bb70-ebfa4135589a
2025-11-06 12:19:21.053000+00:00,"But not enough to stop me from gettin' a nut ""I wanna come over, what's up?"" That's what I told her soon as this episode Of Martin go off,","the TV screen flickered to black, and John's eyes met Kendrick's, who was grinning mischievously, as if to say, ""You know what's",,,,,conv_0bb56093-3033-4615-bb70-ebfa4135589a
2025-11-06 12:19:42.439000+00:00,"Passin' Alameda, my gas meter in need of a pump I got enough to get me through the traffic jam At least I hope, 'cause my pockets broke","and the mama van's engine sputtered, as if echoing John's concern, but Kendrick just nodded sympathetically, his mind still preoccupied with the memories of Sherane",,,,,conv_0bb56093-3033-4615-bb70-ebfa4135589a
2025-11-06 12:20:12.986000+00:00,"I had a fifth in the trunk like Curtis Jackson for ransom I'm hopin' to get her loose like an Uncle Luke anthem I'm two blocks away, two","minutes from her doorstep, and the anticipation was building up, as John's fingers drummed against the steering wheel, and Kendrick started to rap along, ""Two blocks away,",,,,,conv_0bb56093-3033-4615-bb70-ebfa4135589a
2025-11-06 12:20:49.460000+00:00,"Kendrick, where you at? Damn, I'm sittin' here waitin' on my van You told me you was gon' be back","in a minute, but the minutes turned to hours, and the hours turned to silence, leaving John Cena alone in the mama van, the only sound being the hum of the",,,,,conv_0bb56093-3033-4615-bb70-ebfa4135589a
2025-11-06 12:23:08.273000+00:00,"I need to know when you gon' bring back my damn car (And squab, homie) This man fussin' 'bout some damn dominoes It ain't all that","serious, but John's patience had worn thin, and he let out a loud ""LETS FLIPFLOPPING DO THIS!"" as he stormed out of the mama",,,,,conv_0bb56093-3033-4615-bb70-ebfa4135589a
2025-10-20 08:52:36.796000+00:00,This is the story of,"Maya, a young botanist who had always been fascinated by the rare and mysterious plants that grew in the remote mountain regions",,,,,conv_0d0e6cb2-79a6-4347-8734-584ab1d8823a
