timestamp,user,ai,combined_prompt,client_id,workshop_id,language,conversation_id
2025-11-11 19:21:58.964000+00:00,"fixed point directly in front of her. Wheater was cloudy and was starting raining. Aria, after some minutes, understand that the woman was a real ghost and stopped","speaking, standing there in silence as the rain began to fall around them, drumming against the pavement and casting a misty veil over the town. The woman's gaze",,,,,conv_9a9b4068-5437-4eac-9cbd-738309827685
2025-11-11 19:25:51.483000+00:00,"... non, better, the woman started moving forward. An ancient house was just the other side of the street. Aria followed her and takes her right hand as she was her","mother, feeling an inexplicable sense of comfort and familiarity as she walked alongside the mysterious woman, the rain soaking through their clothes as they reached the entrance of the ancient house,",,,,,conv_9a9b4068-5437-4eac-9cbd-738309827685
2025-11-11 19:30:39.542000+00:00,"the black wood door seemed a closed mouth. Aria pushed the bell and waited... someone asked: ""go away, no one is there""... Aria pushed the door and entered. The ghost","glided in beside her, and together they stepped into the musty darkness of the hall, the air thick with the scent of decay and forgotten memories. Aria's eyes",,,,,conv_9a9b4068-5437-4eac-9cbd-738309827685
2025-11-11 19:34:03.445000+00:00,"started fixing an obscure corridor... at the end a lamp blinked at her. The ghost was frightened from that corridor and stopped. Aria, suddenly, understand the true...",,,,,,conv_9a9b4068-5437-4eac-9cbd-738309827685
2025-10-29 09:03:45.505000+00:00,This is the story of,"a lighthouse keeper who had forgotten how to dream.

For seventeen years, Magdalena had climbed the spiral stairs each evening, lit the great",,,,,conv_a0840d98-89b5-4206-b414-e9820d9a99b2
2025-10-29 09:07:11.434000+00:00,"big beam that circled night after night, warning ships of her presence. The fear was not that they might die upon impact,","but that she might finally have to speak to another living soul.

The isolation had become her armor, the light her only companion. She knew every crack in the lens,",,,,,conv_a0840d98-89b5-4206-b414-e9820d9a99b2
2025-10-29 09:09:52.160000+00:00,"how its broken beams of light shattered the water into millions of pieces, and the comforting silence","that followed each rotation—three seconds of darkness between every sweep.

But on this particular night, something was different. The fog rolled in thicker than usual, and within",,,,,conv_a0840d98-89b5-4206-b414-e9820d9a99b2
2025-10-29 09:11:49.720000+00:00,"she could make out the faint outline of a skib carefully bobbing near the shore, a single, tall figure carefully extricating","themselves from the vessel. They moved with deliberate grace, as if the fog itself parted to allow their passage.

Magdalena's hand froze on the lamp",,,,,conv_a0840d98-89b5-4206-b414-e9820d9a99b2
2025-10-29 09:13:02.536000+00:00,". The figure, a man maybe, looked up suddenly as the pattern of light the man grew accustomed to","had stuttered—interrupted by her trembling grip. For the first time in seventeen years, Magdalena had broken the rhythm.

She watched as the figure raised one",,,,,conv_a0840d98-89b5-4206-b414-e9820d9a99b2
2025-10-29 09:14:31.095000+00:00,"finger and spin it slowly in a circle. Magdalena knew he saw her now, but had no clue as to what","the gesture meant. A greeting? A command? Her heart hammered against her ribs as she released the lamp, letting it resume its eternal dance.

The figure began",,,,,conv_a0840d98-89b5-4206-b414-e9820d9a99b2
2025-10-29 09:15:42.050000+00:00,"working once more, securing his boat to the shore, before begin his trek to what she could only assume was","her lighthouse. Each step deliberate, unhurried, as though he'd made this journey a thousand times before in dreams she'd never had.

Magdalena descende",,,,,conv_a0840d98-89b5-4206-b414-e9820d9a99b2
2025-10-29 09:17:29.901000+00:00,"d back into the lighthouse, steeling herself for the inevitable. Now more than ever, she wished she had procured a knife, a bat, something","to steady her shaking hands. But there was only the worn rope railing and the echo of her own footsteps spiraling downward.

Three sharp knocks",,,,,conv_a0840d98-89b5-4206-b414-e9820d9a99b2
2025-10-29 09:18:51.755000+00:00,pierced her skull. Her heart threatned to jump out of her chest as she slowly approached the door. Resting her hand on the,"cold iron handle, she drew a breath that tasted of salt and rust. The knocks came again—patient, rhythmic, like the lamp above.

""I",,,,,conv_a0840d98-89b5-4206-b414-e9820d9a99b2
2025-10-29 09:21:06.926000+00:00,"am so grateful I happened across your light! I was pulled out to sea by a mighty strong current, and am sure I'd be fish food now",,,,,,conv_a0840d98-89b5-4206-b414-e9820d9a99b2
2025-11-13 10:15:27.047000+00:00,This is the story of,"a small, mysterious village nestled deep within a valley, where the air was sweet with the scent of blooming wildflowers and the sky seemed to stretch on forever. The village",,,,,conv_b0f0e7b9-40d0-4776-a1a7-828df5bdcf2a
2025-11-13 10:16:23.783000+00:00,"was known for its large wooden cathedrals, connected with eachother by wooden bridges, used by","the villagers as a unique network of pathways that crisscrossed above the village, allowing them to move easily from one cathedral to another, and it was here that the village",,,,,conv_b0f0e7b9-40d0-4776-a1a7-828df5bdcf2a
2025-11-13 10:18:34.540000+00:00,"became famous for its mathematicians, calculating the possibilities for crossing. There were rules as to who and when and what directions","one could take, and the mathematicians would spend hours pondering the intricacies of the bridge system, trying to find the most efficient routes and patterns, while the village elders",,,,,conv_b0f0e7b9-40d0-4776-a1a7-828df5bdcf2a
2025-11-13 10:19:23.785000+00:00,"tried to convince the mathematicians that the spirit of the law could be broken, even though","the village's founder, a wise and enigmatic figure named Aria, had decreed that the bridges were to be crossed in a specific and sacred pattern, a pattern that",,,,,conv_b0f0e7b9-40d0-4776-a1a7-828df5bdcf2a
2025-11-13 10:20:19.522000+00:00,"required to people cross the bridge in the opposite direction at the same times as you. That made it hard to get over the bridge, and","led to a complex dance of pedestrians, each trying to navigate the bridges while respecting the ancient tradition, and it was not uncommon to see a group of people awkwardly waiting at",,,,,conv_b0f0e7b9-40d0-4776-a1a7-828df5bdcf2a
2025-11-13 10:20:59.439000+00:00,"the junctions of the bridges, waiting for the exact right circumstances that made the crossing legal. If you","timed it just right, you could catch the brief window of opportunity when the mirror-image stranger, as the villagers called them, would be crossing from the opposite direction, allowing",,,,,conv_b0f0e7b9-40d0-4776-a1a7-828df5bdcf2a
2025-11-13 10:21:45.516000+00:00,"you to cross the bridge legally. Some outlaws despised Aria, and crossed the bridges as they wished,","defying the tradition and incurring the wrath of the village elders, who would often convene in emergency councils to discuss the outlaw's transgression and determine a suitable punishment,",,,,,conv_b0f0e7b9-40d0-4776-a1a7-828df5bdcf2a
2025-11-13 10:22:43.264000+00:00,Often the punishment would be a year without bridgetravelling. They would then have to walk around in the,"muddy and winding paths that skirted the village, a circuitous and arduous route that would add hours to their daily journeys, and serve as a humiliating reminder of",,,,,conv_b0f0e7b9-40d0-4776-a1a7-828df5bdcf2a
2025-11-13 10:23:39.319000+00:00,"what they had done. People from the bridge would look down at them at best, but usually just ignore them,","as if they were ghosts or shadows, invisible and insignificant, and the outcasts would have to endure the scorn and indifference of their former friends and neighbors, a painful reminder of",,,,,conv_b0f0e7b9-40d0-4776-a1a7-828df5bdcf2a
2025-11-13 10:24:51.585000+00:00,how much power Aria and his allies held. There was a growing resistance from the bridge,,,,,,conv_b0f0e7b9-40d0-4776-a1a7-828df5bdcf2a
2025-11-09 16:05:02.428000+00:00,This is the story of,"a young girl named Sophia, who lived in a small village surrounded by vast, rolling hills and dense forests. She had always been fascinated by the stories her grandmother used to tell",,,,,conv_b1e0225e-fdb5-4142-8852-0785c0d30420
2025-11-09 16:07:21.883000+00:00,about the trolls roaming the forests. She told tales of misfortune happening to any children that would wander too far,"into the woods, and how they would never return, or if they did, they would be forever changed by the encounter, with a haunting look in their eyes and a whisper",,,,,conv_b1e0225e-fdb5-4142-8852-0785c0d30420
2025-11-09 16:11:49.474000+00:00,", warning others about the horrible hairy creatures. Many did not believe the stories, chalking them up to superstition. But Sophia believed","every word her grandmother spoke, and she made it a point to avoid the forest, staying close to the village and its familiar surroundings. However, on one fateful evening,",,,,,conv_b1e0225e-fdb5-4142-8852-0785c0d30420
2025-11-09 16:16:00.140000+00:00,"her steadfastness would be put to the test. You see, Sophia had a strange addiction: Matcha Lattes. This addiction had often lead her to spend","all her allowance and even some of her earnings from helping her mother with the family bakery, just to get her hands on a cup of the vibrant green drink from the traveling merchant",,,,,conv_b1e0225e-fdb5-4142-8852-0785c0d30420
2025-11-09 16:17:53.885000+00:00,"that took a whopping 75kr for each cup. But Sophia had an idea: if she could follow the merchant, she might learn the secrets of the recipe,","and thus be able to make her own Matcha Lattes, saving herself a fortune and satiating her craving without breaking the bank. So, she decided to sneak out",,,,,conv_b1e0225e-fdb5-4142-8852-0785c0d30420
2025-11-09 16:19:25.548000+00:00,"one evening, hiding in the side of the road for the merchant to pass. The merchant came just after nightfall, trotting along with a","large, worn-out wagon, its wooden slats creaking as it moved, and Sophia quickly darted out from her hiding spot, falling into step behind the wagon,",,,,,conv_b1e0225e-fdb5-4142-8852-0785c0d30420
2025-11-09 16:21:45.540000+00:00,"stealthily sneaking up and grabbing on to the railing. Sophia felt like a true ninja, thinking to herself that grandma","would be proud of her cunning, but her pride was short-lived, as the wagon suddenly lurched to a stop, and Sophia found herself face to face with the merchant,",,,,,conv_b1e0225e-fdb5-4142-8852-0785c0d30420
2025-11-09 16:23:27.378000+00:00,"who looked at her grimly. ""Do you seek to steal my Matcha Latte recipe, young girl?"", she asked while Sophia gasped. ""No dear merchant, i just happened","to be out for a midnight stroll and saw your wagon, and I was curious about where you were headed,"" Sophia stammered, trying to come up with a believable excuse",,,,,conv_b1e0225e-fdb5-4142-8852-0785c0d30420
2025-11-09 16:25:22.904000+00:00,". The merchant laughed: ""Do you think me a fool? I know you have been coveting my Matcha Lattes since you first tasted them girl. But this was a","test, and you have passed, for I have been searching for an apprentice, someone with a passion for the Matcha Latte that rivals my own, and I believe that",,,,,conv_b1e0225e-fdb5-4142-8852-0785c0d30420
2025-11-09 16:28:00.753000+00:00,"you could become even stronger than me, if you put in the effort"". Sophia was flabbergasted, she had not anticipated such a turn",,,,,,conv_b1e0225e-fdb5-4142-8852-0785c0d30420
2025-11-13 13:28:31.116000+00:00,This is the story of,a young girl named Sophia who lived in a small village surrounded by dense forests and rolling hills. She had always been fascinated by the stories her grandmother used to tell her about the,,,,,conv_b306d0b7-35f0-495e-a3e0-5818c3ae060c
2025-11-13 13:32:43.972000+00:00,"big castle nearby. She used to say that there lived fairies, trolls, wizards and a lot of wonderful creatures. Aside from the creatures there also lived a","prince, who was said to be kind and just, loved by all the inhabitants of the castle and the surrounding lands. According to Sophia's grandmother, the prince was on",,,,,conv_b306d0b7-35f0-495e-a3e0-5818c3ae060c
2025-11-13 13:34:58.672000+00:00,"a mission to find the perfect girl, so he could get married. The prince lost his parents years ago, so all he had was the creatures. The prince have been stuck on","this quest for what felt like an eternity, meeting many girls along the way, but none of them seemed quite right. He had almost given up hope when he heard about a",,,,,conv_b306d0b7-35f0-495e-a3e0-5818c3ae060c
2025-11-13 13:36:45.634000+00:00,girl living in a small village surrounded be forrest. A girl named Sophia. The prince is stuck in the same age until he finds,"his true love, and legend had it that Sophia was the one. The prince's advisor, a wise old wizard, had told him that Sophia possessed a heart full of kindness",,,,,conv_b306d0b7-35f0-495e-a3e0-5818c3ae060c
2025-11-13 13:38:51.455000+00:00,"and goodness. A heart so pure, that was never seen before. But the prince was stuck in his castle, and Sophia didn't know how to find","her way to the castle, for the path was hidden behind a veil of illusions, cast by the wicked sorceress who sought to keep the prince and Sophia apart, fearing",,,,,conv_b306d0b7-35f0-495e-a3e0-5818c3ae060c
2025-11-13 13:41:12.026000+00:00,"that Sophia would ruin the world with her kindness. It turns out, that Sophia is a descendant from the best fairy ever seen. The power she carries is unlimited,","and it was said that if she were to marry the prince, their union would bring about a new era of peace and harmony, and the sorceress knew that her own",,,,,conv_b306d0b7-35f0-495e-a3e0-5818c3ae060c
2025-11-13 13:42:50.939000+00:00,"power would disapear, and her plan of world domination would crumble. One day Sophia woke up and felt brave. She wanted to find the prince and find her","true destiny, so she packed a small bag and set out towards the castle, following a narrow path that she had never seen before, but somehow felt drawn to. As she",,,,,conv_b306d0b7-35f0-495e-a3e0-5818c3ae060c
2025-11-13 13:44:27.464000+00:00,walked along the path she met a troll guarding a bridge to cross a lake. The troll wanted to test the goodness of her,"heart, and so he presented her with a challenge: to answer a riddle that would prove her kindness and selflessness. The troll's riddle was: ""What can",,,,,conv_b306d0b7-35f0-495e-a3e0-5818c3ae060c
2025-11-13 13:46:29.299000+00:00,"give and give, but never take'?"" Sophia was a bit puzzled, but then she remembered what her grandmother once told her a long","time ago, that the answer to this riddle was ""love"", for love can give and give, but it can never take, only receive in return. The troll was",,,,,conv_b306d0b7-35f0-495e-a3e0-5818c3ae060c
2025-11-13 13:47:30.892000+00:00,"pleased with her answer, and gave her a little gift she would need later. He then followed her over the bridge, and wished her",,,,,,conv_b306d0b7-35f0-495e-a3e0-5818c3ae060c
2025-10-20 18:08:47.579000+00:00,This is the story of,"Elena Rodriguez, a young marine biologist who had always dreamed of exploring the depths of the Pacific Ocean. Growing up in a small coastal town in Chile, she had spent countless hours watching the waves and imagining the mysterious creatures that lived beneath the surface. Her tiny bedroom was adorned with posters of marine life,",,,,,conv_c2e0197b-bba1-43b9-978e-cc6e536892b3
2025-10-20 18:12:49.047000+00:00,"whales and dolphins, octopussies and weird fish that few people knew existed. From early on, she had been snorkeling in the clear waters, and with the help of a local diver, Juan Antonio, she became an expert in telling the sea life apart.","Juan Antonio was more than just a mentor; he was like a second father to Elena. A weathered, salt-and-pepper-haired man in his sixties, he had spent most of his life diving and studying the marine ecosystems along the Chilean coast. He recognized Elena's passion early on and took her under his wing, teaching",,,,,conv_c2e0197b-bba1-43b9-978e-cc6e536892b3
2025-10-20 18:14:48.220000+00:00,"her how to get close to the sea life. They had a unique friendship, but one day Elena came to the beach and saw that Juan Antonio's lifeless body had been recovered from the sea that he loved so much. The 16-year old was heartbroken promised to honor","his memory by dedicating her life to marine conservation and research. The local authorities had ruled his death as a diving accident, but something about the circumstances didn't sit right with Elena. Juan Antonio was an experienced diver who knew these waters better than anyone. His wetsuit was oddly torn, and there were strange marks on his diving equipment that",,,,,conv_c2e0197b-bba1-43b9-978e-cc6e536892b3
2025-10-20 18:22:43.408000+00:00,"did not make sense to Elena. It was not a shark attack, which would have been much more bloody. It looked like he had been held down, and a knife had cut his suit. Elena looked around. Was his murderer one of the men standing at the café overlooking","the beach? She recognized some of them as local fishermen, but one man—a stranger with cold, calculating eyes—seemed out of place. He was dressed too formally for a seaside town, wearing a dark suit that looked expensive and out of place among the weathered fishing jackets and work clothes of the other men. When he caught",,,,,conv_c2e0197b-bba1-43b9-978e-cc6e536892b3
2025-10-20 18:27:12.818000+00:00,"her eyes, he starred coldly back at Elena until she looked away. Who would do something to Juan Antonio, the kindest person she ever met. She looked again and the stranger began to leave, and she noticed the large bag he picked up as he headed for","a sleek black SUV parked just beyond the café. Something metallic glinted inside the bag when he shifted it, catching the sunlight. Elena's instincts, honed by years of careful observation with Juan Antonio, told her this was no ordinary piece of luggage. Her grief suddenly mixed with a burning curiosity and a",,,,,conv_c2e0197b-bba1-43b9-978e-cc6e536892b3
2025-10-20 18:34:25.899000+00:00,"sense of urgency. As the SUV drove away, she caught the license plate. With the help of a friend in the police, she learned that the owner of the car was a hitman. Had Juan Antonio been onto something that gave him enemies? Was this about the polluti","on that was destroying the marine ecosystem? Juan Antonio had been vocal about illegal fishing practices and the environmental damage caused by certain industrial operations along the coast. Elena remembered late-night conversations where he would whisper about powerful people who wanted to silence those who spoke out against their destructive practices. She began to dig deeper, accessing Juan Antonio's research notes",,,,,conv_c2e0197b-bba1-43b9-978e-cc6e536892b3
2025-10-20 18:36:26.728000+00:00,"that showed that a big chemistry plant a few miles up the coast was spilling all kinds of waste from their production into the ocean through a hidden pipe. Juan Antonio had taken pictures with his underwater camera, and there was a draft","of a report he was preparing to submit to environmental authorities. The draft detailed not just the pollution, but potential links between the chemical plant's waste and significant marine life die-offs in the region. Elena realized that her mentor might have been killed to prevent this information from becoming public. The draft was meticulously researched, with precise measurements of",,,,,conv_c2e0197b-bba1-43b9-978e-cc6e536892b3
2025-10-20 18:37:53.724000+00:00,"the amount of spillage and sample that proved that toxins of all kinds were discharged into the precious waters that Elena loved so much. But what could she do? Would she be in danger, too? Would the police believe her?","Elena knew local law enforcement had its own complex web of relationships with powerful local industries. Simply walking into the police station with Juan Antonio's evidence might put her at risk. She decided to be strategic, making digital copies of the documents and photos, then sending encrypted versions to an international marine conservation organization she had contacted during her research. If something happened to",,,,,conv_c2e0197b-bba1-43b9-978e-cc6e536892b3
2025-10-20 18:43:44.401000+00:00,"her, there would be not just one lead, but plenty, and there would be idealists like herself who would take things further. As she put her plan in motion, the man appeared before her on the street one day. ""Be careful,"" he said with a slick smile.","Elena's heart raced, but she kept her composure. Years of studying marine predators had taught her that showing fear could be fatal. ""I'm not afraid of you,"" she responded coolly, her voice steady despite the adrenaline coursing through her veins. The man's smile didn't waver, but his eyes",,,,,conv_c2e0197b-bba1-43b9-978e-cc6e536892b3
2025-10-20 18:47:34.628000+00:00,"did not have the stern look, she saw the first time. She turned on her dictaphone in her pocket. ""You're not half the man Juan Antonio was,"" she said calmly. The stranger scruffed. ""Then why did he die so quickly in my hands?""",,,,,,conv_c2e0197b-bba1-43b9-978e-cc6e536892b3
2025-10-17 12:47:28.290000+00:00,This is the story of,"a small village nestled in the heart of a vast, enchanted forest. The village, known as Elderglen, was a place where the trees whispered secrets and the air hummed with magic. For generations, the villagers had lived in harmony with the forest, guided by the wisdom of the Elder, an ancient and revered figure. But as the seasons",,,,,conv_c427623a-0b3b-4cef-9d4e-ec3a2649128c
2025-10-17 13:17:42.192000+00:00,sdfakjlsdflj askjldf jklasdjklf ajklsdfjkl asjkdlf jklasdf asdf kalsdflka,"It seems there was a misstep in our storytelling. Let's try to continue the tale where we left off:

But as the seasons changed, a mysterious darkness began to creep into the forest. The trees grew quieter, and the once vibrant colors of the leaves began to fade. The villagers noticed that the animals were acting strangely, and the usual sense",,,,,conv_c427623a-0b3b-4cef-9d4e-ec3a2649128c
2025-10-17 13:19:30+00:00,sadajsdjk ajkds jkasjkd jaksd kjasdjk ajksd ajksdjka sdjkajks djkasd,"It seems there was a bit of a mix-up. Let's keep the story flowing:

The villagers noticed that the animals were acting strangely, and the usual sense of peace was replaced by an eerie tension. One night, under a moonless sky, the Elder called for a meeting in the village square. The air was thick with worry as the villagers",,,,,conv_c427623a-0b3b-4cef-9d4e-ec3a2649128c
2025-10-17 13:19:57.705000+00:00,sadf asdklf kalæsdfælaæklsdfækl asækldf æklasdælk faæklsdf æklasdkæfæaklsd,"It seemed like the forest was whispering secrets as the wind blew through the ancient trees. The rustling leaves and snapping twigs echoed in the quiet, creating a symphony of the wild. In the midst of this serene chaos, a small, worn path emerged, winding its way deeper into the heart of the forest. 

Eleanor, a",,,,,conv_c427623a-0b3b-4cef-9d4e-ec3a2649128c
2025-10-17 13:20:14.159000+00:00,sdfkl klsdfkl sdklf lksdklf klsfd klsklf klsdklf skldf klsdklf klsdfs,"Eleanor, a young woman with a curious spirit and a heart full of adventure, stepped onto the path. Her eyes were wide with anticipation, and a small, leather-bound journal hung from her belt. She had heard tales of this forest, stories of mystical creatures and hidden treasures, and she was determined to uncover its secrets. 

As she walked",,,,,conv_c427623a-0b3b-4cef-9d4e-ec3a2649128c
2025-10-17 13:20:33.202000+00:00,sdfkl skldf klsdklf klsdfkl slkdf klsdklf kls klfkl dsfslfsæl,"As she walked, the path grew narrower and the trees loomed taller, their branches intertwining overhead to form a canopy that filtered the sunlight into dappled patterns on the ground. Eleanor's footsteps were light and purposeful, her senses heightened by the mystery that surrounded her. Suddenly, a soft, melodic sound caught her attention, like the",,,,,conv_c427623a-0b3b-4cef-9d4e-ec3a2649128c
2025-10-17 13:29:31.305000+00:00,sadfjk asdjlkf ljkasdjklf asljkdf jklasdfklj asdljfaljskdfjlasdjlfasd,"It seems there was a bit of a mishap with the last message. Let's try to pick up the story where we left off. 

 previously, the forest was growing darker, and the old oak tree at the edge of the clearing seemed to whisper secrets of the past. The wind rustled through the leaves, and the air was thick with",,,,,conv_c427623a-0b3b-4cef-9d4e-ec3a2649128c
2025-10-17 13:29:50.562000+00:00,dsælfkls dlfkæslkd æklæsdfækls fdæls klæ sdfæksfdkæs dflæ sdfkæs ækls dfkæs fdæks dkæls dfsdff dsd fslæsækld l ædks,"It looks like there might be some technical issues with the messages. Let’s continue the story from where we were:

The forest was growing darker, and the old oak tree at the edge of the clearing seemed to whisper secrets of the past. The wind rustled through the leaves, and the air was thick with an eerie silence. Suddenly, a faint",,,,,conv_c427623a-0b3b-4cef-9d4e-ec3a2649128c
2025-10-17 13:30:16.169000+00:00,whisper from jack the sparrow came from tghe tree and he went,"A faint whisper from Jack the Sparrow came from the tree, and he went deeper into the shadows. His voice was barely audible, but it carried a sense of urgency. ""Follow me, but tread lightly,"" he murmured, his eyes glinting with a mix of curiosity and caution. The forest seemed to hold its breath as the group",,,,,conv_c427623a-0b3b-4cef-9d4e-ec3a2649128c
